{
  "lesson_id": "careers8_goal_setting",
  "subject": "Careers",
  "grade": 8,
  "topic": "Goal Setting",
  "lesson_label": null,
  "theme": "careers",
  "big_idea": "Reflecting on our preferences and skills helps us identify the steps we need to take to achieve our career goals.",
  "time_minutes": 79,
  "class_context": {
    "chromebooks": true,
    "mixed_ability": true,
    "prior_reflection": true
  },
  "learning_goals": [
    "I can identify what makes a goal stronger or weaker.",
    "I can improve a vague goal by making it clearer and more realistic.",
    "I can create one goal with a practical next-step plan."
  ],
  "slides": [
    {
      "type": "TITLE",
      "title": "Goal Setting",
      "layout": "hero",
      "content": {
        "subtitle": "Turning intentions into usable plans"
      }
    },
    {
      "type": "ENGAGE",
      "title": "Which goal is stronger?",
      "layout": "two_column_compare",
      "content": {
        "left": "Goal A: Do better in school.",
        "right": "Goal B: Bring missing assignments up to date this week by finishing one after school each day.",
        "prompts": [
          "Which goal would actually help someone move forward?",
          "What makes it stronger?"
        ]
      }
    },
    {
      "type": "LEARN",
      "title": "A goal is not just a wish",
      "layout": "two_column",
      "content": {
        "left": [
          "A wish is something you hope for.",
          "It may matter to you, but it does not tell you what to do next."
        ],
        "right": [
          "A goal is something you are working toward.",
          "A plan is the actions that help you move toward the goal."
        ]
      }
    },
    {
      "type": "LEARN",
      "title": "What makes a goal useful?",
      "layout": "checklist",
      "content": {
        "items": [
          "a clear target",
          "realistic scope",
          "a reason it matters",
          "one first action step",
          "a plan for an obstacle or support"
        ]
      }
    },
    {
      "type": "DO",
      "title": "Fix the weak goal",
      "layout": "prompt_card",
      "content": {
        "goal": "Get healthier.",
        "prompts": [
          "What is missing?",
          "How could we improve this goal so it becomes more usable?"
        ]
      }
    },
    {
      "type": "DO",
      "title": "Try another one",
      "layout": "prompt_card",
      "content": {
        "goal": "Save money.",
        "prompts": [
          "How much?",
          "By when?",
          "What first step?",
          "What could get in the way?"
        ]
      }
    },
    {
      "type": "MAKE_SENSE",
      "title": "What could get in the way?",
      "layout": "bullet_focus",
      "content": {
        "headline": "Obstacles are normal. They do not mean the goal is bad.",
        "items": [
          "forgetting",
          "running out of time",
          "distractions",
          "low confidence",
          "no routine",
          "not knowing what to do first"
        ]
      }
    },
    {
      "type": "MAKE_SENSE",
      "title": "Supports and next steps",
      "layout": "planner_model",
      "content": {
        "model": "Goal → first step → likely obstacle → support or adjustment",
        "supports": [
          "reminder on phone",
          "check-in with someone",
          "set routine time",
          "break the task smaller",
          "change the timeline"
        ]
      }
    },
    {
      "type": "APPLY",
      "title": "Write your own goal plan",
      "layout": "retrieval",
      "content": {
        "areas": [
          "school",
          "activity or sport",
          "savings",
          "habit or routine",
          "personal growth"
        ],
        "task": "Write your goal, why it matters, one first step, one likely obstacle, and one support or adjustment."
      }
    },
    {
      "type": "APPLY",
      "title": "Make the plan stronger",
      "layout": "checklist",
      "content": {
        "items": [
          "Is my goal still too vague?",
          "Is it too huge for right now?",
          "Do I know my first step?",
          "Did I plan for a likely obstacle?",
          "Do I have a support or adjustment?"
        ]
      }
    },
    {
      "type": "REFLECT",
      "title": "Exit reflection",
      "layout": "reflect",
      "content": {
        "prompts": [
          "One thing that makes a goal stronger is ...",
          "A goal is different from a wish because ...",
          "One next action I could actually take is ..."
        ]
      }
    },
    {
      "type": "EXTEND",
      "title": "If we finish early: Make it stronger",
      "layout": "prompt",
      "content": {
        "task": "Pick one weak goal and improve it, or compare two versions of the same goal and explain which one is more usable."
      }
    }
  ],
  "worksheets": {
    "supported": {
      "anchor": [
        "A strong goal helps you act.",
        "A useful plan includes a first step, a likely obstacle, and a support or adjustment."
      ],
      "tip": "Ask: What could I actually do next?",
      "questions": [
        {
          "q_num": 1,
          "q_text": "Circle the stronger goal from class and write one reason why it is stronger.",
          "n_lines": 2,
          "slide_ref": "S2"
        },
        {
          "q_num": 2,
          "q_text": "Finish the checklist: a stronger goal has a clear target, realistic scope, a reason it matters, one first step, and one support or obstacle plan.",
          "n_lines": 3,
          "slide_ref": "S4"
        },
        {
          "q_num": 3,
          "q_text": "Rewrite the weak goal Save money so it becomes more usable.",
          "n_lines": 3,
          "slide_ref": "S6"
        },
        {
          "q_num": 4,
          "q_text": "Write one goal you could actually work on. Include why it matters, one first step, one obstacle, and one support or adjustment.",
          "n_lines": 5,
          "slide_ref": "S9"
        }
      ],
      "self_check": [
        "Did you include what you will do first?",
        "Did you plan for at least one obstacle?"
      ],
      "answer_key": [
        "Goal B is stronger because it has a clear action and time frame.",
        "Strong answers include target, time frame, first step, and support."
      ]
    },
    "proficient": {
      "anchor": [
        "A stronger goal usually includes a clear target, realistic scope, a reason it matters, one first step, and a plan for a likely obstacle.",
        "Useful goals are clear enough to guide action."
      ],
      "questions": [
        {
          "q_num": 1,
          "q_text": "Compare Goal A and Goal B from class. Which goal is more useful, and why?",
          "n_lines": 3,
          "slide_ref": "S2"
        },
        {
          "q_num": 2,
          "q_text": "List five things that make a goal stronger or more usable.",
          "n_lines": 3,
          "slide_ref": "S4"
        },
        {
          "q_num": 3,
          "q_text": "Rewrite each weak goal so it becomes more usable: Get healthier. Save money.",
          "n_lines": 4,
          "slide_ref": "S6"
        },
        {
          "q_num": 4,
          "q_text": "Create one realistic goal with a reason, one first step, one likely obstacle, and one support or adjustment. Explain why your version is stronger than a wish.",
          "n_lines": 5,
          "slide_ref": "S9"
        }
      ],
      "self_check": [
        "Did your revised goals become more specific and realistic?",
        "Does your goal plan show what you can do next and how you will respond to a barrier?"
      ],
      "answer_key": [
        "Goal B is stronger because it is clearer, more realistic, and gives an action step.",
        "Look for clear target, realistic scope, reason it matters, first step, and obstacle/support plan."
      ]
    },
    "extending": {
      "anchor": [
        "Goal setting is not only about deciding what you want. It is about designing a plan that can survive reality: time limits, setbacks, distractions, and revision.",
        "Use reflection on preferences and skills to build concrete steps."
      ],
      "questions": [
        {
          "q_num": 1,
          "q_text": "Explain why a strong goal is more useful than a vague wish. Use one example.",
          "n_lines": 4,
          "slide_ref": "S4"
        },
        {
          "q_num": 2,
          "q_text": "Rewrite Get healthier and Save money into stronger goals. Then explain what improved in each one.",
          "n_lines": 4,
          "slide_ref": "S6"
        },
        {
          "q_num": 3,
          "q_text": "Choose one revised goal and explain one realistic obstacle, one support, and how you would revise the plan after a setback.",
          "n_lines": 4,
          "slide_ref": "S7"
        },
        {
          "q_num": 4,
          "q_text": "Using the Big Idea wording, argue why reflecting on preferences and skills should lead to concrete steps rather than only big intentions.",
          "n_lines": 4,
          "slide_ref": "S8"
        }
      ],
      "self_check": [
        "Did you explain the difference between usefulness and inspiration?",
        "Did your obstacle and support response sound realistic?"
      ],
      "answer_key": [
        "Stronger answers show how reflection leads to action, not just intention.",
        "A strong revision-after-setback move changes the plan instead of abandoning it."
      ]
    }
  },
  "rubrics": [
    {
      "tier": "proficient",
      "title": "Q4 — Goal plan",
      "question": "Create one realistic goal with a reason, one first step, one likely obstacle, and one support or adjustment. Explain why your version is stronger than a wish.",
      "criteria": [
        {
          "criterion": "Quality of goal plan",
          "emerging": "Goal is present but vague or missing major planning parts.",